Sheet: Calendar
B2: title
B4: of:=DATE(YEAR(TODAY());MONTH(TODAY());1) -> 2018-12-01 | J4: of:=DATE(YEAR([.B4]);MONTH([.B4])+ 1;1) -> 2019-01-01 | R4: of:=DATE(YEAR([.B4]);MONTH([.B4])+ 2;1) -> 2019-02-01
B6: of:=VLOOKUP([Configuration.$D$3];[Configuration.$D$7:.$F$13];3;0) -> 1900-01-01 | C6: of:=[.B6]+ 1 -> 1900-01-02 | D6: of:=[.B6]+ 2 -> 1900-01-03 | E6: of:=[.B6]+ 3 -> 1900-01-04 | F6: of:=[.B6]+ 4 -> 1900-01-05 | G6: of:=[.B6]+ 5 -> 1900-01-06 | H6: of:=[.B6]+ 6 -> 1900-01-07 | J6: of:=[.B6:.H6] -> 1900-01-01 | K6: 1900-01-02 | L6: 1900-01-03 | M6: 1900-01-04 | N6: 1900-01-05 | O6: 1900-01-06 | P6: 1900-01-07 | R6: of:=[.B6:.H6] -> 1900-01-01 | S6: 1900-01-02 | T6: 1900-01-03 | U6: 1900-01-04 | V6: 1900-01-05 | W6: 1900-01-06 | X6: 1900-01-07
B7: of:=(WEEKDAY([.B4])=WEEKDAY([.B6]))*[.B4] -> 0 | C7: of:=(WEEKDAY([.B4])=WEEKDAY([.C6]))*[.B4]+([.B7]>0)+[.B7] -> 0 | D7: of:=(WEEKDAY([.B4])=WEEKDAY([.D6]))*[.B4]+([.C7]>0)+[.C7] -> 0 | E7: of:=(WEEKDAY([.B4])=WEEKDAY([.E6]))*[.B4]+([.D7]>0)+[.D7] -> 0 | F7: of:=(WEEKDAY([.B4])=WEEKDAY([.F6]))*[.B4]+([.E7]>0)+[.E7] -> 0 | G7: of:=(WEEKDAY([.B4])=WEEKDAY([.G6]))*[.B4]+([.F7]>0)+[.F7] -> 43435 | H7: of:=(WEEKDAY([.B4])=WEEKDAY([.H6]))*[.B4]+([.G7]>0)+[.G7] -> 43436 | J7: of:=(WEEKDAY([.J4])=WEEKDAY([.J6]))*[.J4] -> 0 | K7: of:=(WEEKDAY([.J4])=WEEKDAY([.K6]))*[.J4]+([.J7]>0)+[.J7] -> 43466 | L7: of:=(WEEKDAY([.J4])=WEEKDAY([.L6]))*[.J4]+([.K7]>0)+[.K7] -> 43467 | M7: of:=(WEEKDAY([.J4])=WEEKDAY([.M6]))*[.J4]+([.L7]>0)+[.L7] -> 43468 | N7: of:=(WEEKDAY([.J4])=WEEKDAY([.N6]))*[.J4]+([.M7]>0)+[.M7] -> 43469 | O7: of:=(WEEKDAY([.J4])=WEEKDAY([.O6]))*[.J4]+([.N7]>0)+[.N7] -> 43470 | P7: of:=(WEEKDAY([.J4])=WEEKDAY([.P6]))*[.J4]+([.O7]>0)+[.O7] -> 43471 | R7: of:=(WEEKDAY([.R4])=WEEKDAY([.R6]))*[.R4] -> 0 | S7: of:=(WEEKDAY([.R4])=WEEKDAY([.S6]))*[.R4]+([.R7]>0)+[.R7] -> 0 | T7: of:=(WEEKDAY([.R4])=WEEKDAY([.T6]))*[.R4]+([.S7]>0)+[.S7] -> 0 | U7: of:=(WEEKDAY([.R4])=WEEKDAY([.U6]))*[.R4]+([.T7]>0)+[.T7] -> 0 | V7: of:=(WEEKDAY([.R4])=WEEKDAY([.V6]))*[.R4]+([.U7]>0)+[.U7] -> 43497 | W7: of:=(WEEKDAY([.R4])=WEEKDAY([.W6]))*[.R4]+([.V7]>0)+[.V7] -> 43498 | X7: of:=(WEEKDAY([.R4])=WEEKDAY([.X6]))*[.R4]+([.W7]>0)+[.W7] -> 43499
B8: of:=+[.H7]+1 -> 43437 | C8: of:=+[.B8]+1 -> 43438 | D8: of:=+[.C8]+1 -> 43439 | E8: of:=+[.D8]+1 -> 43440 | F8: of:=+[.E8]+1 -> 43441 | G8: of:=+[.F8]+1 -> 43442 | H8: of:=+[.G8]+1 -> 43443 | J8: of:=+[.P7]+1 -> 43472 | K8: of:=+[.J8]+1 -> 43473 | L8: of:=+[.K8]+1 -> 43474 | M8: of:=+[.L8]+1 -> 43475 | N8: of:=+[.M8]+1 -> 43476 | O8: of:=+[.N8]+1 -> 43477 | P8: of:=+[.O8]+1 -> 43478 | R8: of:=+[.X7]+1 -> 43500 | S8: of:=+[.R8]+1 -> 43501 | T8: of:=+[.S8]+1 -> 43502 | U8: of:=+[.T8]+1 -> 43503 | V8: of:=+[.U8]+1 -> 43504 | W8: of:=+[.V8]+1 -> 43505 | X8: of:=+[.W8]+1 -> 43506
B9: of:=+[.H8]+1 -> 43444 | C9: of:=+[.B9]+1 -> 43445 | D9: of:=+[.C9]+1 -> 43446 | E9: of:=+[.D9]+1 -> 43447 | F9: of:=+[.E9]+1 -> 43448 | G9: of:=+[.F9]+1 -> 43449 | H9: of:=+[.G9]+1 -> 43450 | J9: of:=+[.P8]+1 -> 43479 | K9: of:=+[.J9]+1 -> 43480 | L9: of:=+[.K9]+1 -> 43481 | M9: of:=+[.L9]+1 -> 43482 | N9: of:=+[.M9]+1 -> 43483 | O9: of:=+[.N9]+1 -> 43484 | P9: of:=+[.O9]+1 -> 43485 | R9: of:=+[.X8]+1 -> 43507 | S9: of:=+[.R9]+1 -> 43508 | T9: of:=+[.S9]+1 -> 43509 | U9: of:=+[.T9]+1 -> 43510 | V9: of:=+[.U9]+1 -> 43511 | W9: of:=+[.V9]+1 -> 43512 | X9: of:=+[.W9]+1 -> 43513
B10: of:=+[.H9]+1 -> 43451 | C10: of:=+[.B10]+1 -> 43452 | D10: of:=+[.C10]+1 -> 43453 | E10: of:=+[.D10]+1 -> 43454 | F10: of:=+[.E10]+1 -> 43455 | G10: of:=+[.F10]+1 -> 43456 | H10: of:=+[.G10]+1 -> 43457 | J10: of:=+[.P9]+1 -> 43486 | K10: of:=+[.J10]+1 -> 43487 | L10: of:=+[.K10]+1 -> 43488 | M10: of:=+[.L10]+1 -> 43489 | N10: of:=+[.M10]+1 -> 43490 | O10: of:=+[.N10]+1 -> 43491 | P10: of:=+[.O10]+1 -> 43492 | R10: of:=+[.X9]+1 -> 43514 | S10: of:=+[.R10]+1 -> 43515 | T10: of:=+[.S10]+1 -> 43516 | U10: of:=+[.T10]+1 -> 43517 | V10: of:=+[.U10]+1 -> 43518 | W10: of:=+[.V10]+1 -> 43519 | X10: of:=+[.W10]+1 -> 43520
B11: of:=(AND([.H10];MONTH([.H10]+1)=MONTH([.B4])))*([.H10]+1) -> 43458 | C11: of:=(AND([.B11];MONTH([.B11]+1)=MONTH([.B4])))*([.B11]+1) -> 43459 | D11: of:=(AND([.C11];MONTH([.C11]+1)=MONTH([.B4])))*([.C11]+1) -> 43460 | E11: of:=(AND([.D11];MONTH([.D11]+1)=MONTH([.B4])))*([.D11]+1) -> 43461 | F11: of:=(AND([.E11];MONTH([.E11]+1)=MONTH([.B4])))*([.E11]+1) -> 43462 | G11: of:=(AND([.F11];MONTH([.F11]+1)=MONTH([.B4])))*([.F11]+1) -> 43463 | H11: of:=(AND([.G11];MONTH([.G11]+1)=MONTH([.B4])))*([.G11]+1) -> 43464 | J11: of:=(AND([.P10];MONTH([.P10]+1)=MONTH([.J4])))*([.P10]+1) -> 43493 | K11: of:=(AND([.J11];MONTH([.J11]+1)=MONTH([.J4])))*([.J11]+1) -> 43494 | L11: of:=(AND([.K11];MONTH([.K11]+1)=MONTH([.J4])))*([.K11]+1) -> 43495 | M11: of:=(AND([.L11];MONTH([.L11]+1)=MONTH([.J4])))*([.L11]+1) -> 43496 | N11: of:=(AND([.M11];MONTH([.M11]+1)=MONTH([.J4])))*([.M11]+1) -> 0 | O11: of:=(AND([.N11];MONTH([.N11]+1)=MONTH([.J4])))*([.N11]+1) -> 0 | P11: of:=(AND([.O11];MONTH([.O11]+1)=MONTH([.J4])))*([.O11]+1) -> 0 | R11: of:=(AND([.X10];MONTH([.X10]+1)=MONTH([.R4])))*([.X10]+1) -> 43521 | S11: of:=(AND([.R11];MONTH([.R11]+1)=MONTH([.R4])))*([.R11]+1) -> 43522 | T11: of:=(AND([.S11];MONTH([.S11]+1)=MONTH([.R4])))*([.S11]+1) -> 43523 | U11: of:=(AND([.T11];MONTH([.T11]+1)=MONTH([.R4])))*([.T11]+1) -> 43524 | V11: of:=(AND([.U11];MONTH([.U11]+1)=MONTH([.R4])))*([.U11]+1) -> 0 | W11: of:=(AND([.V11];MONTH([.V11]+1)=MONTH([.R4])))*([.V11]+1) -> 0 | X11: of:=(AND([.W11];MONTH([.W11]+1)=MONTH([.R4])))*([.W11]+1) -> 0
B12: of:=(AND([.H11];MONTH([.H11]+1)=MONTH([.B4])))*([.H11]+1) -> 43465 | C12: of:=(AND([.B12];MONTH([.B12]+1)=MONTH([.B4])))*([.B12]+1) -> 0 | D12: of:=(AND([.C12];MONTH([.C12]+1)=MONTH([.B4])))*([.C12]+1) -> 0 | E12: of:=(AND([.D12];MONTH([.D12]+1)=MONTH([.B4])))*([.D12]+1) -> 0 | F12: of:=(AND([.E12];MONTH([.E12]+1)=MONTH([.B4])))*([.E12]+1) -> 0 | G12: of:=(AND([.F12];MONTH([.F12]+1)=MONTH([.B4])))*([.F12]+1) -> 0 | H12: of:=(AND([.G12];MONTH([.G12]+1)=MONTH([.B4])))*([.G12]+1) -> 0 | J12: of:=(AND([.P11];MONTH([.P11]+1)=MONTH([.J4])))*([.P11]+1) -> 0 | K12: of:=(AND([.J12];MONTH([.J12]+1)=MONTH([.J4])))*([.J12]+1) -> 0 | L12: of:=(AND([.K12];MONTH([.K12]+1)=MONTH([.J4])))*([.K12]+1) -> 0 | M12: of:=(AND([.L12];MONTH([.L12]+1)=MONTH([.J4])))*([.L12]+1) -> 0 | N12: of:=(AND([.M12];MONTH([.M12]+1)=MONTH([.J4])))*([.M12]+1) -> 0 | O12: of:=(AND([.N12];MONTH([.N12]+1)=MONTH([.J4])))*([.N12]+1) -> 0 | P12: of:=(AND([.O12];MONTH([.O12]+1)=MONTH([.J4])))*([.O12]+1) -> 0 | R12: of:=(AND([.X11];MONTH([.X11]+1)=MONTH([.R4])))*([.X11]+1) -> 0 | S12: of:=(AND([.R12];MONTH([.R12]+1)=MONTH([.R4])))*([.R12]+1) -> 0 | T12: of:=(AND([.S12];MONTH([.S12]+1)=MONTH([.R4])))*([.S12]+1) -> 0 | U12: of:=(AND([.T12];MONTH([.T12]+1)=MONTH([.R4])))*([.T12]+1) -> 0 | V12: of:=(AND([.U12];MONTH([.U12]+1)=MONTH([.R4])))*([.U12]+1) -> 0 | W12: of:=(AND([.V12];MONTH([.V12]+1)=MONTH([.R4])))*([.V12]+1) -> 0 | X12: of:=(AND([.W12];MONTH([.W12]+1)=MONTH([.R4])))*([.W12]+1) -> 0
B14: of:=DATE(YEAR([.B4]);MONTH([.B4])+ 3;1) -> 2019-03-01 | J14: of:=DATE(YEAR([.B4]);MONTH([.B4])+ 4;1) -> 2019-04-01 | R14: of:=DATE(YEAR([.B4]);MONTH([.B4])+ 5;1) -> 2019-05-01
B16: of:=[.B6:.H6] -> 1900-01-01 | C16: 1900-01-02 | D16: 1900-01-03 | E16: 1900-01-04 | F16: 1900-01-05 | G16: 1900-01-06 | H16: 1900-01-07 | J16: of:=[.B6:.H6] -> 1900-01-01 | K16: 1900-01-02 | L16: 1900-01-03 | M16: 1900-01-04 | N16: 1900-01-05 | O16: 1900-01-06 | P16: 1900-01-07 | R16: of:=[.B6:.H6] -> 1900-01-01 | S16: 1900-01-02 | T16: 1900-01-03 | U16: 1900-01-04 | V16: 1900-01-05 | W16: 1900-01-06 | X16: 1900-01-07
B17: of:=(WEEKDAY([.B14])=WEEKDAY([.B16]))*[.B14] -> 0 | C17: of:=(WEEKDAY([.B14])=WEEKDAY([.C16]))*[.B14]+([.B17]>0)+[.B17] -> 0 | D17: of:=(WEEKDAY([.B14])=WEEKDAY([.D16]))*[.B14]+([.C17]>0)+[.C17] -> 0 | E17: of:=(WEEKDAY([.B14])=WEEKDAY([.E16]))*[.B14]+([.D17]>0)+[.D17] -> 0 | F17: of:=(WEEKDAY([.B14])=WEEKDAY([.F16]))*[.B14]+([.E17]>0)+[.E17] -> 43525 | G17: of:=(WEEKDAY([.B14])=WEEKDAY([.G16]))*[.B14]+([.F17]>0)+[.F17] -> 43526 | H17: of:=(WEEKDAY([.B14])=WEEKDAY([.H16]))*[.B14]+([.G17]>0)+[.G17] -> 43527 | J17: of:=(WEEKDAY([.J14])=WEEKDAY([.J16]))*[.J14] -> 43556 | K17: of:=(WEEKDAY([.J14])=WEEKDAY([.K16]))*[.J14]+([.J17]>0)+[.J17] -> 43557 | L17: of:=(WEEKDAY([.J14])=WEEKDAY([.L16]))*[.J14]+([.K17]>0)+[.K17] -> 43558 | M17: of:=(WEEKDAY([.J14])=WEEKDAY([.M16]))*[.J14]+([.L17]>0)+[.L17] -> 43559 | N17: of:=(WEEKDAY([.J14])=WEEKDAY([.N16]))*[.J14]+([.M17]>0)+[.M17] -> 43560 | O17: of:=(WEEKDAY([.J14])=WEEKDAY([.O16]))*[.J14]+([.N17]>0)+[.N17] -> 43561 | P17: of:=(WEEKDAY([.J14])=WEEKDAY([.P16]))*[.J14]+([.O17]>0)+[.O17] -> 43562 | R17: of:=(WEEKDAY([.R14])=WEEKDAY([.R16]))*[.R14] -> 0 | S17: of:=(WEEKDAY([.R14])=WEEKDAY([.S16]))*[.R14]+([.R17]>0)+[.R17] -> 0 | T17: of:=(WEEKDAY([.R14])=WEEKDAY([.T16]))*[.R14]+([.S17]>0)+[.S17] -> 43586 | U17: of:=(WEEKDAY([.R14])=WEEKDAY([.U16]))*[.R14]+([.T17]>0)+[.T17] -> 43587 | V17: of:=(WEEKDAY([.R14])=WEEKDAY([.V16]))*[.R14]+([.U17]>0)+[.U17] -> 43588 | W17: of:=(WEEKDAY([.R14])=WEEKDAY([.W16]))*[.R14]+([.V17]>0)+[.V17] -> 43589 | X17: of:=(WEEKDAY([.R14])=WEEKDAY([.X16]))*[.R14]+([.W17]>0)+[.W17] -> 43590
B18: of:=+[.H17]+1 -> 43528 | C18: of:=+[.B18]+1 -> 43529 | D18: of:=+[.C18]+1 -> 43530 | E18: of:=+[.D18]+1 -> 43531 | F18: of:=+[.E18]+1 -> 43532 | G18: of:=+[.F18]+1 -> 43533 | H18: of:=+[.G18]+1 -> 43534 | J18: of:=+[.P17]+1 -> 43563 | K18: of:=+[.J18]+1 -> 43564 | L18: of:=+[.K18]+1 -> 43565 | M18: of:=+[.L18]+1 -> 43566 | N18: of:=+[.M18]+1 -> 43567 | O18: of:=+[.N18]+1 -> 43568 | P18: of:=+[.O18]+1 -> 43569 | R18: of:=+[.X17]+1 -> 43591 | S18: of:=+[.R18]+1 -> 43592 | T18: of:=+[.S18]+1 -> 43593 | U18: of:=+[.T18]+1 -> 43594 | V18: of:=+[.U18]+1 -> 43595 | W18: of:=+[.V18]+1 -> 43596 | X18: of:=+[.W18]+1 -> 43597
B19: of:=+[.H18]+1 -> 43535 | C19: of:=+[.B19]+1 -> 43536 | D19: of:=+[.C19]+1 -> 43537 | E19: of:=+[.D19]+1 -> 43538 | F19: of:=+[.E19]+1 -> 43539 | G19: of:=+[.F19]+1 -> 43540 | H19: of:=+[.G19]+1 -> 43541 | J19: of:=+[.P18]+1 -> 43570 | K19: of:=+[.J19]+1 -> 43571 | L19: of:=+[.K19]+1 -> 43572 | M19: of:=+[.L19]+1 -> 43573 | N19: of:=+[.M19]+1 -> 43574 | O19: of:=+[.N19]+1 -> 43575 | P19: of:=+[.O19]+1 -> 43576 | R19: of:=+[.X18]+1 -> 43598 | S19: of:=+[.R19]+1 -> 43599 | T19: of:=+[.S19]+1 -> 43600 | U19: of:=+[.T19]+1 -> 43601 | V19: of:=+[.U19]+1 -> 43602 | W19: of:=+[.V19]+1 -> 43603 | X19: of:=+[.W19]+1 -> 43604
B20: of:=+[.H19]+1 -> 43542 | C20: of:=+[.B20]+1 -> 43543 | D20: of:=+[.C20]+1 -> 43544 | E20: of:=+[.D20]+1 -> 43545 | F20: of:=+[.E20]+1 -> 43546 | G20: of:=+[.F20]+1 -> 43547 | H20: of:=+[.G20]+1 -> 43548 | J20: of:=+[.P19]+1 -> 43577 | K20: of:=+[.J20]+1 -> 43578 | L20: of:=+[.K20]+1 -> 43579 | M20: of:=+[.L20]+1 -> 43580 | N20: of:=+[.M20]+1 -> 43581 | O20: of:=+[.N20]+1 -> 43582 | P20: of:=+[.O20]+1 -> 43583 | R20: of:=+[.X19]+1 -> 43605 | S20: of:=+[.R20]+1 -> 43606 | T20: of:=+[.S20]+1 -> 43607 | U20: of:=+[.T20]+1 -> 43608 | V20: of:=+[.U20]+1 -> 43609 | W20: of:=+[.V20]+1 -> 43610 | X20: of:=+[.W20]+1 -> 43611
B21: of:=(AND([.H20];MONTH([.H20]+1)=MONTH([.B14])))*([.H20]+1) -> 43549 | C21: of:=(AND([.B21];MONTH([.B21]+1)=MONTH([.B14])))*([.B21]+1) -> 43550 | D21: of:=(AND([.C21];MONTH([.C21]+1)=MONTH([.B14])))*([.C21]+1) -> 43551 | E21: of:=(AND([.D21];MONTH([.D21]+1)=MONTH([.B14])))*([.D21]+1) -> 43552 | F21: of:=(AND([.E21];MONTH([.E21]+1)=MONTH([.B14])))*([.E21]+1) -> 43553 | G21: of:=(AND([.F21];MONTH([.F21]+1)=MONTH([.B14])))*([.F21]+1) -> 43554 | H21: of:=(AND([.G21];MONTH([.G21]+1)=MONTH([.B14])))*([.G21]+1) -> 43555 | J21: of:=(AND([.P20];MONTH([.P20]+1)=MONTH([.J14])))*([.P20]+1) -> 43584 | K21: of:=(AND([.J21];MONTH([.J21]+1)=MONTH([.J14])))*([.J21]+1) -> 43585 | L21: of:=(AND([.K21];MONTH([.K21]+1)=MONTH([.J14])))*([.K21]+1) -> 0 | M21: of:=(AND([.L21];MONTH([.L21]+1)=MONTH([.J14])))*([.L21]+1) -> 0 | N21: of:=(AND([.M21];MONTH([.M21]+1)=MONTH([.J14])))*([.M21]+1) -> 0 | O21: of:=(AND([.N21];MONTH([.N21]+1)=MONTH([.J14])))*([.N21]+1) -> 0 | P21: of:=(AND([.O21];MONTH([.O21]+1)=MONTH([.J14])))*([.O21]+1) -> 0 | R21: of:=(AND([.X20];MONTH([.X20]+1)=MONTH([.R14])))*([.X20]+1) -> 43612 | S21: of:=(AND([.R21];MONTH([.R21]+1)=MONTH([.R14])))*([.R21]+1) -> 43613 | T21: of:=(AND([.S21];MONTH([.S21]+1)=MONTH([.R14])))*([.S21]+1) -> 43614 | U21: of:=(AND([.T21];MONTH([.T21]+1)=MONTH([.R14])))*([.T21]+1) -> 43615 | V21: of:=(AND([.U21];MONTH([.U21]+1)=MONTH([.R14])))*([.U21]+1) -> 43616 | W21: of:=(AND([.V21];MONTH([.V21]+1)=MONTH([.R14])))*([.V21]+1) -> 0 | X21: of:=(AND([.W21];MONTH([.W21]+1)=MONTH([.R14])))*([.W21]+1) -> 0
B22: of:=(AND([.H21];MONTH([.H21]+1)=MONTH([.B14])))*([.H21]+1) -> 0 | C22: of:=(AND([.B22];MONTH([.B22]+1)=MONTH([.B14])))*([.B22]+1) -> 0 | D22: of:=(AND([.C22];MONTH([.C22]+1)=MONTH([.B14])))*([.C22]+1) -> 0 | E22: of:=(AND([.D22];MONTH([.D22]+1)=MONTH([.B14])))*([.D22]+1) -> 0 | F22: of:=(AND([.E22];MONTH([.E22]+1)=MONTH([.B14])))*([.E22]+1) -> 0 | G22: of:=(AND([.F22];MONTH([.F22]+1)=MONTH([.B14])))*([.F22]+1) -> 0 | H22: of:=(AND([.G22];MONTH([.G22]+1)=MONTH([.B14])))*([.G22]+1) -> 0 | J22: of:=(AND([.P21];MONTH([.P21]+1)=MONTH([.J14])))*([.P21]+1) -> 0 | K22: of:=(AND([.J22];MONTH([.J22]+1)=MONTH([.J14])))*([.J22]+1) -> 0 | L22: of:=(AND([.K22];MONTH([.K22]+1)=MONTH([.J14])))*([.K22]+1) -> 0 | M22: of:=(AND([.L22];MONTH([.L22]+1)=MONTH([.J14])))*([.L22]+1) -> 0 | N22: of:=(AND([.M22];MONTH([.M22]+1)=MONTH([.J14])))*([.M22]+1) -> 0 | O22: of:=(AND([.N22];MONTH([.N22]+1)=MONTH([.J14])))*([.N22]+1) -> 0 | P22: of:=(AND([.O22];MONTH([.O22]+1)=MONTH([.J14])))*([.O22]+1) -> 0 | R22: of:=(AND([.X21];MONTH([.X21]+1)=MONTH([.R14])))*([.X21]+1) -> 0 | S22: of:=(AND([.R22];MONTH([.R22]+1)=MONTH([.R14])))*([.R22]+1) -> 0 | T22: of:=(AND([.S22];MONTH([.S22]+1)=MONTH([.R14])))*([.S22]+1) -> 0 | U22: of:=(AND([.T22];MONTH([.T22]+1)=MONTH([.R14])))*([.T22]+1) -> 0 | V22: of:=(AND([.U22];MONTH([.U22]+1)=MONTH([.R14])))*([.U22]+1) -> 0 | W22: of:=(AND([.V22];MONTH([.V22]+1)=MONTH([.R14])))*([.V22]+1) -> 0 | X22: of:=(AND([.W22];MONTH([.W22]+1)=MONTH([.R14])))*([.W22]+1) -> 0
B24: of:=DATE(YEAR([.B4]);MONTH([.B4])+ 6;1) -> 2019-06-01 | J24: of:=DATE(YEAR([.B4]);MONTH([.B4])+ 7;1) -> 2019-07-01 | R24: of:=DATE(YEAR([.B4]);MONTH([.B4])+ 8;1) -> 2019-08-01
B26: of:=[.B6:.H6] -> 1900-01-01 | C26: 1900-01-02 | D26: 1900-01-03 | E26: 1900-01-04 | F26: 1900-01-05 | G26: 1900-01-06 | H26: 1900-01-07 | J26: of:=[.B6:.H6] -> 1900-01-01 | K26: 1900-01-02 | L26: 1900-01-03 | M26: 1900-01-04 | N26: 1900-01-05 | O26: 1900-01-06 | P26: 1900-01-07 | R26: of:=[.B6:.H6] -> 1900-01-01 | S26: 1900-01-02 | T26: 1900-01-03 | U26: 1900-01-04 | V26: 1900-01-05 | W26: 1900-01-06 | X26: 1900-01-07
B27: of:=(WEEKDAY([.B24])=WEEKDAY([.B26]))*[.B24] -> 0 | C27: of:=(WEEKDAY([.B24])=WEEKDAY([.C26]))*[.B24]+([.B27]>0)+[.B27] -> 0 | D27: of:=(WEEKDAY([.B24])=WEEKDAY([.D26]))*[.B24]+([.C27]>0)+[.C27] -> 0 | E27: of:=(WEEKDAY([.B24])=WEEKDAY([.E26]))*[.B24]+([.D27]>0)+[.D27] -> 0 | F27: of:=(WEEKDAY([.B24])=WEEKDAY([.F26]))*[.B24]+([.E27]>0)+[.E27] -> 0 | G27: of:=(WEEKDAY([.B24])=WEEKDAY([.G26]))*[.B24]+([.F27]>0)+[.F27] -> 43617 | H27: of:=(WEEKDAY([.B24])=WEEKDAY([.H26]))*[.B24]+([.G27]>0)+[.G27] -> 43618 | J27: of:=(WEEKDAY([.J24])=WEEKDAY([.J26]))*[.J24] -> 43647 | K27: of:=(WEEKDAY([.J24])=WEEKDAY([.K26]))*[.J24]+([.J27]>0)+[.J27] -> 43648 | L27: of:=(WEEKDAY([.J24])=WEEKDAY([.L26]))*[.J24]+([.K27]>0)+[.K27] -> 43649 | M27: of:=(WEEKDAY([.J24])=WEEKDAY([.M26]))*[.J24]+([.L27]>0)+[.L27] -> 43650 | N27: of:=(WEEKDAY([.J24])=WEEKDAY([.N26]))*[.J24]+([.M27]>0)+[.M27] -> 43651 | O27: of:=(WEEKDAY([.J24])=WEEKDAY([.O26]))*[.J24]+([.N27]>0)+[.N27] -> 43652 | P27: of:=(WEEKDAY([.J24])=WEEKDAY([.P26]))*[.J24]+([.O27]>0)+[.O27] -> 43653 | R27: of:=(WEEKDAY([.R24])=WEEKDAY([.R26]))*[.R24] -> 0 | S27: of:=(WEEKDAY([.R24])=WEEKDAY([.S26]))*[.R24]+([.R27]>0)+[.R27] -> 0 | T27: of:=(WEEKDAY([.R24])=WEEKDAY([.T26]))*[.R24]+([.S27]>0)+[.S27] -> 0 | U27: of:=(WEEKDAY([.R24])=WEEKDAY([.U26]))*[.R24]+([.T27]>0)+[.T27] -> 43678 | V27: of:=(WEEKDAY([.R24])=WEEKDAY([.V26]))*[.R24]+([.U27]>0)+[.U27] -> 43679 | W27: of:=(WEEKDAY([.R24])=WEEKDAY([.W26]))*[.R24]+([.V27]>0)+[.V27] -> 43680 | X27: of:=(WEEKDAY([.R24])=WEEKDAY([.X26]))*[.R24]+([.W27]>0)+[.W27] -> 43681
B28: of:=+[.H27]+1 -> 43619 | C28: of:=+[.B28]+1 -> 43620 | D28: of:=+[.C28]+1 -> 43621 | E28: of:=+[.D28]+1 -> 43622 | F28: of:=+[.E28]+1 -> 43623 | G28: of:=+[.F28]+1 -> 43624 | H28: of:=+[.G28]+1 -> 43625 | J28: of:=+[.P27]+1 -> 43654 | K28: of:=+[.J28]+1 -> 43655 | L28: of:=+[.K28]+1 -> 43656 | M28: of:=+[.L28]+1 -> 43657 | N28: of:=+[.M28]+1 -> 43658 | O28: of:=+[.N28]+1 -> 43659 | P28: of:=+[.O28]+1 -> 43660 | R28: of:=+[.X27]+1 -> 43682 | S28: of:=+[.R28]+1 -> 43683 | T28: of:=+[.S28]+1 -> 43684 | U28: of:=+[.T28]+1 -> 43685 | V28: of:=+[.U28]+1 -> 43686 | W28: of:=+[.V28]+1 -> 43687 | X28: of:=+[.W28]+1 -> 43688
B29: of:=+[.H28]+1 -> 43626 | C29: of:=+[.B29]+1 -> 43627 | D29: of:=+[.C29]+1 -> 43628 | E29: of:=+[.D29]+1 -> 43629 | F29: of:=+[.E29]+1 -> 43630 | G29: of:=+[.F29]+1 -> 43631 | H29: of:=+[.G29]+1 -> 43632 | J29: of:=+[.P28]+1 -> 43661 | K29: of:=+[.J29]+1 -> 43662 | L29: of:=+[.K29]+1 -> 43663 | M29: of:=+[.L29]+1 -> 43664 | N29: of:=+[.M29]+1 -> 43665 | O29: of:=+[.N29]+1 -> 43666 | P29: of:=+[.O29]+1 -> 43667 | R29: of:=+[.X28]+1 -> 43689 | S29: of:=+[.R29]+1 -> 43690 | T29: of:=+[.S29]+1 -> 43691 | U29: of:=+[.T29]+1 -> 43692 | V29: of:=+[.U29]+1 -> 43693 | W29: of:=+[.V29]+1 -> 43694 | X29: of:=+[.W29]+1 -> 43695
B30: of:=+[.H29]+1 -> 43633 | C30: of:=+[.B30]+1 -> 43634 | D30: of:=+[.C30]+1 -> 43635 | E30: of:=+[.D30]+1 -> 43636 | F30: of:=+[.E30]+1 -> 43637 | G30: of:=+[.F30]+1 -> 43638 | H30: of:=+[.G30]+1 -> 43639 | J30: of:=+[.P29]+1 -> 43668 | K30: of:=+[.J30]+1 -> 43669 | L30: of:=+[.K30]+1 -> 43670 | M30: of:=+[.L30]+1 -> 43671 | N30: of:=+[.M30]+1 -> 43672 | O30: of:=+[.N30]+1 -> 43673 | P30: of:=+[.O30]+1 -> 43674 | R30: of:=+[.X29]+1 -> 43696 | S30: of:=+[.R30]+1 -> 43697 | T30: of:=+[.S30]+1 -> 43698 | U30: of:=+[.T30]+1 -> 43699 | V30: of:=+[.U30]+1 -> 43700 | W30: of:=+[.V30]+1 -> 43701 | X30: of:=+[.W30]+1 -> 43702
B31: of:=(AND([.H30];MONTH([.H30]+1)=MONTH([.B24])))*([.H30]+1) -> 43640 | C31: of:=(AND([.B31];MONTH([.B31]+1)=MONTH([.B24])))*([.B31]+1) -> 43641 | D31: of:=(AND([.C31];MONTH([.C31]+1)=MONTH([.B24])))*([.C31]+1) -> 43642 | E31: of:=(AND([.D31];MONTH([.D31]+1)=MONTH([.B24])))*([.D31]+1) -> 43643 | F31: of:=(AND([.E31];MONTH([.E31]+1)=MONTH([.B24])))*([.E31]+1) -> 43644 | G31: of:=(AND([.F31];MONTH([.F31]+1)=MONTH([.B24])))*([.F31]+1) -> 43645 | H31: of:=(AND([.G31];MONTH([.G31]+1)=MONTH([.B24])))*([.G31]+1) -> 43646 | J31: of:=(AND([.P30];MONTH([.P30]+1)=MONTH([.J24])))*([.P30]+1) -> 43675 | K31: of:=(AND([.J31];MONTH([.J31]+1)=MONTH([.J24])))*([.J31]+1) -> 43676 | L31: of:=(AND([.K31];MONTH([.K31]+1)=MONTH([.J24])))*([.K31]+1) -> 43677 | M31: of:=(AND([.L31];MONTH([.L31]+1)=MONTH([.J24])))*([.L31]+1) -> 0 | N31: of:=(AND([.M31];MONTH([.M31]+1)=MONTH([.J24])))*([.M31]+1) -> 0 | O31: of:=(AND([.N31];MONTH([.N31]+1)=MONTH([.J24])))*([.N31]+1) -> 0 | P31: of:=(AND([.O31];MONTH([.O31]+1)=MONTH([.J24])))*([.O31]+1) -> 0 | R31: of:=(AND([.X30];MONTH([.X30]+1)=MONTH([.R24])))*([.X30]+1) -> 43703 | S31: of:=(AND([.R31];MONTH([.R31]+1)=MONTH([.R24])))*([.R31]+1) -> 43704 | T31: of:=(AND([.S31];MONTH([.S31]+1)=MONTH([.R24])))*([.S31]+1) -> 43705 | U31: of:=(AND([.T31];MONTH([.T31]+1)=MONTH([.R24])))*([.T31]+1) -> 43706 | V31: of:=(AND([.U31];MONTH([.U31]+1)=MONTH([.R24])))*([.U31]+1) -> 43707 | W31: of:=(AND([.V31];MONTH([.V31]+1)=MONTH([.R24])))*([.V31]+1) -> 43708 | X31: of:=(AND([.W31];MONTH([.W31]+1)=MONTH([.R24])))*([.W31]+1) -> 0
B32: of:=(AND([.H31];MONTH([.H31]+1)=MONTH([.B24])))*([.H31]+1) -> 0 | C32: of:=(AND([.B32];MONTH([.B32]+1)=MONTH([.B24])))*([.B32]+1) -> 0 | D32: of:=(AND([.C32];MONTH([.C32]+1)=MONTH([.B24])))*([.C32]+1) -> 0 | E32: of:=(AND([.D32];MONTH([.D32]+1)=MONTH([.B24])))*([.D32]+1) -> 0 | F32: of:=(AND([.E32];MONTH([.E32]+1)=MONTH([.B24])))*([.E32]+1) -> 0 | G32: of:=(AND([.F32];MONTH([.F32]+1)=MONTH([.B24])))*([.F32]+1) -> 0 | H32: of:=(AND([.G32];MONTH([.G32]+1)=MONTH([.B24])))*([.G32]+1) -> 0 | J32: of:=(AND([.P31];MONTH([.P31]+1)=MONTH([.J24])))*([.P31]+1) -> 0 | K32: of:=(AND([.J32];MONTH([.J32]+1)=MONTH([.J24])))*([.J32]+1) -> 0 | L32: of:=(AND([.K32];MONTH([.K32]+1)=MONTH([.J24])))*([.K32]+1) -> 0 | M32: of:=(AND([.L32];MONTH([.L32]+1)=MONTH([.J24])))*([.L32]+1) -> 0 | N32: of:=(AND([.M32];MONTH([.M32]+1)=MONTH([.J24])))*([.M32]+1) -> 0 | O32: of:=(AND([.N32];MONTH([.N32]+1)=MONTH([.J24])))*([.N32]+1) -> 0 | P32: of:=(AND([.O32];MONTH([.O32]+1)=MONTH([.J24])))*([.O32]+1) -> 0 | R32: of:=(AND([.X31];MONTH([.X31]+1)=MONTH([.R24])))*([.X31]+1) -> 0 | S32: of:=(AND([.R32];MONTH([.R32]+1)=MONTH([.R24])))*([.R32]+1) -> 0 | T32: of:=(AND([.S32];MONTH([.S32]+1)=MONTH([.R24])))*([.S32]+1) -> 0 | U32: of:=(AND([.T32];MONTH([.T32]+1)=MONTH([.R24])))*([.T32]+1) -> 0 | V32: of:=(AND([.U32];MONTH([.U32]+1)=MONTH([.R24])))*([.U32]+1) -> 0 | W32: of:=(AND([.V32];MONTH([.V32]+1)=MONTH([.R24])))*([.V32]+1) -> 0 | X32: of:=(AND([.W32];MONTH([.W32]+1)=MONTH([.R24])))*([.W32]+1) -> 0
B34: of:=DATE(YEAR([.B4]);MONTH([.B4])+ 9;1) -> 2019-09-01 | J34: of:=DATE(YEAR([.B4]);MONTH([.B4])+ 10;1) -> 2019-10-01 | R34: of:=DATE(YEAR([.B4]);MONTH([.B4])+ 11;1) -> 2019-11-01
B36: of:=[.B6:.H6] -> 1900-01-01 | C36: 1900-01-02 | D36: 1900-01-03 | E36: 1900-01-04 | F36: 1900-01-05 | G36: 1900-01-06 | H36: 1900-01-07 | J36: of:=[.B6:.H6] -> 1900-01-01 | K36: 1900-01-02 | L36: 1900-01-03 | M36: 1900-01-04 | N36: 1900-01-05 | O36: 1900-01-06 | P36: 1900-01-07 | R36: of:=[.B6:.H6] -> 1900-01-01 | S36: 1900-01-02 | T36: 1900-01-03 | U36: 1900-01-04 | V36: 1900-01-05 | W36: 1900-01-06 | X36: 1900-01-07
B37: of:=(WEEKDAY([.B34])=WEEKDAY([.B36]))*[.B34] -> 0 | C37: of:=(WEEKDAY([.B34])=WEEKDAY([.C36]))*[.B34]+([.B37]>0)+[.B37] -> 0 | D37: of:=(WEEKDAY([.B34])=WEEKDAY([.D36]))*[.B34]+([.C37]>0)+[.C37] -> 0 | E37: of:=(WEEKDAY([.B34])=WEEKDAY([.E36]))*[.B34]+([.D37]>0)+[.D37] -> 0 | F37: of:=(WEEKDAY([.B34])=WEEKDAY([.F36]))*[.B34]+([.E37]>0)+[.E37] -> 0 | G37: of:=(WEEKDAY([.B34])=WEEKDAY([.G36]))*[.B34]+([.F37]>0)+[.F37] -> 0 | H37: of:=(WEEKDAY([.B34])=WEEKDAY([.H36]))*[.B34]+([.G37]>0)+[.G37] -> 43709 | J37: of:=(WEEKDAY([.J34])=WEEKDAY([.J36]))*[.J34] -> 0 | K37: of:=(WEEKDAY([.J34])=WEEKDAY([.K36]))*[.J34]+([.J37]>0)+[.J37] -> 43739 | L37: of:=(WEEKDAY([.J34])=WEEKDAY([.L36]))*[.J34]+([.K37]>0)+[.K37] -> 43740 | M37: of:=(WEEKDAY([.J34])=WEEKDAY([.M36]))*[.J34]+([.L37]>0)+[.L37] -> 43741 | N37: of:=(WEEKDAY([.J34])=WEEKDAY([.N36]))*[.J34]+([.M37]>0)+[.M37] -> 43742 | O37: of:=(WEEKDAY([.J34])=WEEKDAY([.O36]))*[.J34]+([.N37]>0)+[.N37] -> 43743 | P37: of:=(WEEKDAY([.J34])=WEEKDAY([.P36]))*[.J34]+([.O37]>0)+[.O37] -> 43744 | R37: of:=(WEEKDAY([.R34])=WEEKDAY([.R36]))*[.R34] -> 0 | S37: of:=(WEEKDAY([.R34])=WEEKDAY([.S36]))*[.R34]+([.R37]>0)+[.R37] -> 0 | T37: of:=(WEEKDAY([.R34])=WEEKDAY([.T36]))*[.R34]+([.S37]>0)+[.S37] -> 0 | U37: of:=(WEEKDAY([.R34])=WEEKDAY([.U36]))*[.R34]+([.T37]>0)+[.T37] -> 0 | V37: of:=(WEEKDAY([.R34])=WEEKDAY([.V36]))*[.R34]+([.U37]>0)+[.U37] -> 43770 | W37: of:=(WEEKDAY([.R34])=WEEKDAY([.W36]))*[.R34]+([.V37]>0)+[.V37] -> 43771 | X37: of:=(WEEKDAY([.R34])=WEEKDAY([.X36]))*[.R34]+([.W37]>0)+[.W37] -> 43772
B38: of:=+[.H37]+1 -> 43710 | C38: of:=+[.B38]+1 -> 43711 | D38: of:=+[.C38]+1 -> 43712 | E38: of:=+[.D38]+1 -> 43713 | F38: of:=+[.E38]+1 -> 43714 | G38: of:=+[.F38]+1 -> 43715 | H38: of:=+[.G38]+1 -> 43716 | J38: of:=+[.P37]+1 -> 43745 | K38: of:=+[.J38]+1 -> 43746 | L38: of:=+[.K38]+1 -> 43747 | M38: of:=+[.L38]+1 -> 43748 | N38: of:=+[.M38]+1 -> 43749 | O38: of:=+[.N38]+1 -> 43750 | P38: of:=+[.O38]+1 -> 43751 | R38: of:=+[.X37]+1 -> 43773 | S38: of:=+[.R38]+1 -> 43774 | T38: of:=+[.S38]+1 -> 43775 | U38: of:=+[.T38]+1 -> 43776 | V38: of:=+[.U38]+1 -> 43777 | W38: of:=+[.V38]+1 -> 43778 | X38: of:=+[.W38]+1 -> 43779
B39: of:=+[.H38]+1 -> 43717 | C39: of:=+[.B39]+1 -> 43718 | D39: of:=+[.C39]+1 -> 43719 | E39: of:=+[.D39]+1 -> 43720 | F39: of:=+[.E39]+1 -> 43721 | G39: of:=+[.F39]+1 -> 43722 | H39: of:=+[.G39]+1 -> 43723 | J39: of:=+[.P38]+1 -> 43752 | K39: of:=+[.J39]+1 -> 43753 | L39: of:=+[.K39]+1 -> 43754 | M39: of:=+[.L39]+1 -> 43755 | N39: of:=+[.M39]+1 -> 43756 | O39: of:=+[.N39]+1 -> 43757 | P39: of:=+[.O39]+1 -> 43758 | R39: of:=+[.X38]+1 -> 43780 | S39: of:=+[.R39]+1 -> 43781 | T39: of:=+[.S39]+1 -> 43782 | U39: of:=+[.T39]+1 -> 43783 | V39: of:=+[.U39]+1 -> 43784 | W39: of:=+[.V39]+1 -> 43785 | X39: of:=+[.W39]+1 -> 43786
B40: of:=+[.H39]+1 -> 43724 | C40: of:=+[.B40]+1 -> 43725 | D40: of:=+[.C40]+1 -> 43726 | E40: of:=+[.D40]+1 -> 43727 | F40: of:=+[.E40]+1 -> 43728 | G40: of:=+[.F40]+1 -> 43729 | H40: of:=+[.G40]+1 -> 43730 | J40: of:=+[.P39]+1 -> 43759 | K40: of:=+[.J40]+1 -> 43760 | L40: of:=+[.K40]+1 -> 43761 | M40: of:=+[.L40]+1 -> 43762 | N40: of:=+[.M40]+1 -> 43763 | O40: of:=+[.N40]+1 -> 43764 | P40: of:=+[.O40]+1 -> 43765 | R40: of:=+[.X39]+1 -> 43787 | S40: of:=+[.R40]+1 -> 43788 | T40: of:=+[.S40]+1 -> 43789 | U40: of:=+[.T40]+1 -> 43790 | V40: of:=+[.U40]+1 -> 43791 | W40: of:=+[.V40]+1 -> 43792 | X40: of:=+[.W40]+1 -> 43793
B41: of:=(AND([.H40];MONTH([.H40]+1)=MONTH([.B34])))*([.H40]+1) -> 43731 | C41: of:=(AND([.B41];MONTH([.B41]+1)=MONTH([.B34])))*([.B41]+1) -> 43732 | D41: of:=(AND([.C41];MONTH([.C41]+1)=MONTH([.B34])))*([.C41]+1) -> 43733 | E41: of:=(AND([.D41];MONTH([.D41]+1)=MONTH([.B34])))*([.D41]+1) -> 43734 | F41: of:=(AND([.E41];MONTH([.E41]+1)=MONTH([.B34])))*([.E41]+1) -> 43735 | G41: of:=(AND([.F41];MONTH([.F41]+1)=MONTH([.B34])))*([.F41]+1) -> 43736 | H41: of:=(AND([.G41];MONTH([.G41]+1)=MONTH([.B34])))*([.G41]+1) -> 43737 | J41: of:=(AND([.P40];MONTH([.P40]+1)=MONTH([.J34])))*([.P40]+1) -> 43766 | K41: of:=(AND([.J41];MONTH([.J41]+1)=MONTH([.J34])))*([.J41]+1) -> 43767 | L41: of:=(AND([.K41];MONTH([.K41]+1)=MONTH([.J34])))*([.K41]+1) -> 43768 | M41: of:=(AND([.L41];MONTH([.L41]+1)=MONTH([.J34])))*([.L41]+1) -> 43769 | N41: of:=(AND([.M41];MONTH([.M41]+1)=MONTH([.J34])))*([.M41]+1) -> 0 | O41: of:=(AND([.N41];MONTH([.N41]+1)=MONTH([.J34])))*([.N41]+1) -> 0 | P41: of:=(AND([.O41];MONTH([.O41]+1)=MONTH([.J34])))*([.O41]+1) -> 0 | R41: of:=(AND([.X40];MONTH([.X40]+1)=MONTH([.R34])))*([.X40]+1) -> 43794 | S41: of:=(AND([.R41];MONTH([.R41]+1)=MONTH([.R34])))*([.R41]+1) -> 43795 | T41: of:=(AND([.S41];MONTH([.S41]+1)=MONTH([.R34])))*([.S41]+1) -> 43796 | U41: of:=(AND([.T41];MONTH([.T41]+1)=MONTH([.R34])))*([.T41]+1) -> 43797 | V41: of:=(AND([.U41];MONTH([.U41]+1)=MONTH([.R34])))*([.U41]+1) -> 43798 | W41: of:=(AND([.V41];MONTH([.V41]+1)=MONTH([.R34])))*([.V41]+1) -> 43799 | X41: of:=(AND([.W41];MONTH([.W41]+1)=MONTH([.R34])))*([.W41]+1) -> 0
B42: of:=(AND([.H41];MONTH([.H41]+1)=MONTH([.B34])))*([.H41]+1) -> 43738 | C42: of:=(AND([.B42];MONTH([.B42]+1)=MONTH([.B34])))*([.B42]+1) -> 0 | D42: of:=(AND([.C42];MONTH([.C42]+1)=MONTH([.B34])))*([.C42]+1) -> 0 | E42: of:=(AND([.D42];MONTH([.D42]+1)=MONTH([.B34])))*([.D42]+1) -> 0 | F42: of:=(AND([.E42];MONTH([.E42]+1)=MONTH([.B34])))*([.E42]+1) -> 0 | G42: of:=(AND([.F42];MONTH([.F42]+1)=MONTH([.B34])))*([.F42]+1) -> 0 | H42: of:=(AND([.G42];MONTH([.G42]+1)=MONTH([.B34])))*([.G42]+1) -> 0 | J42: of:=(AND([.P41];MONTH([.P41]+1)=MONTH([.J34])))*([.P41]+1) -> 0 | K42: of:=(AND([.J42];MONTH([.J42]+1)=MONTH([.J34])))*([.J42]+1) -> 0 | L42: of:=(AND([.K42];MONTH([.K42]+1)=MONTH([.J34])))*([.K42]+1) -> 0 | M42: of:=(AND([.L42];MONTH([.L42]+1)=MONTH([.J34])))*([.L42]+1) -> 0 | N42: of:=(AND([.M42];MONTH([.M42]+1)=MONTH([.J34])))*([.M42]+1) -> 0 | O42: of:=(AND([.N42];MONTH([.N42]+1)=MONTH([.J34])))*([.N42]+1) -> 0 | P42: of:=(AND([.O42];MONTH([.O42]+1)=MONTH([.J34])))*([.O42]+1) -> 0 | R42: of:=(AND([.X41];MONTH([.X41]+1)=MONTH([.R34])))*([.X41]+1) -> 0 | S42: of:=(AND([.R42];MONTH([.R42]+1)=MONTH([.R34])))*([.R42]+1) -> 0 | T42: of:=(AND([.S42];MONTH([.S42]+1)=MONTH([.R34])))*([.S42]+1) -> 0 | U42: of:=(AND([.T42];MONTH([.T42]+1)=MONTH([.R34])))*([.T42]+1) -> 0 | V42: of:=(AND([.U42];MONTH([.U42]+1)=MONTH([.R34])))*([.U42]+1) -> 0 | W42: of:=(AND([.V42];MONTH([.V42]+1)=MONTH([.R34])))*([.V42]+1) -> 0 | X42: of:=(AND([.W42];MONTH([.W42]+1)=MONTH([.R34])))*([.W42]+1) -> 0

Sheet: Dates
A1: Date | B1: Calendar | C1: Event | D1: of:="Dates.$A$2:$A" & TEXT([.E1];"#") -> Dates.$A$2:$A4 | E1: of:=MAX(IF(ISBLANK([.$A$2:.$A$5000]);0;ROW([.$A$2:.$A$5000]))) -> 4
A2: for each="key in sorted(ocurrences)"
A3: key | B3: ocurrences[key][0][0] | C3: ocurrences[key][0][1]
A4: /for

Sheet: Configuration
C3: 1. First day of week | D3: lun
C6: 2. Mark as holidays
C7: 1 | D7: of:=TEXT([.C7];"DDD") -> dom | E7: true | F7: of:=[.C7] -> 1
C8: of:=IF([.C7]<7;[.C7]+1;1) -> 2 | D8: of:=TEXT([.C8];"DDD") -> lun | E8: false | F8: of:=[.C8] -> 2
C9: of:=IF([.C8]<7;[.C8]+1;1) -> 3 | D9: of:=TEXT([.C9];"DDD") -> mar | E9: false | F9: of:=[.C9] -> 3
C10: of:=IF([.C9]<7;[.C9]+1;1) -> 4 | D10: of:=TEXT([.C10];"DDD") -> mié | E10: false | F10: of:=[.C10] -> 4
C11: of:=IF([.C10]<7;[.C10]+1;1) -> 5 | D11: of:=TEXT([.C11];"DDD") -> jue | E11: false | F11: of:=[.C11] -> 5
C12: of:=IF([.C11]<7;[.C11]+1;1) -> 6 | D12: of:=TEXT([.C12];"DDD") -> vie | E12: false | F12: of:=[.C12] -> 6
C13: of:=IF([.C12]<7;[.C12]+1;1) -> 7 | D13: of:=TEXT([.C13];"DDD") -> sáb | E13: true | F13: of:=[.C13] -> 7
C16: 3. Mark today | D16: 1